index,published,keyword,domain,language,valid,title,description,url,image,archive,content,quote,de,en,la,added
2c0445862d8155ee2c536d7443f594e0,2026-03-09T05:54:26Z,'Frost',www.stern.de,de,0.9,Wetter: Nebel und Sonne in Rheinland-Pfalz und im Saarland,"Barweiler (lrs) - In den Vormittagsstunden gibt es in Rheinland-Pfalz und im Saarland lokal Nebel, in geschützten Tallagen auch Frost. Sobald sich diese",https://www.stern.de/gesellschaft/regional/rheinland-pfalz-saarland/wetter--nebel-und-sonne-in-rheinland-pfalz-und-im-saarland-37203164.html,https://image.stern.de/37203166/t/l_/v1/w1440/r1.7778/-/09--o7k5j4hrtov6axs2048jpeg---90c97a6cce3bfd83.jpg,,"Kopiere den aktuellen Link
Zur Merkliste hinzufügen
Sobald der Nebel sich aufgelöst hat, zeigt sich die Sonne: So ist die Lage aktuell in Rheinland-Pfalz und im Saarland.
In den Vormittagsstunden … [+394 chars]",,"Wetter: Nebel und Sonne in Rheinland-Pfalz und im Saarland. Barweiler (lrs) - In den Vormittagsstunden gibt es in Rheinland-Pfalz und im Saarland lokal Nebel, in geschützten Tallagen auch Frost. Sobald sich diese","Weather: Fog and sun in Rhineland-Palatinate and Saarland. Barweiler (lrs) - In the morning hours there is local fog in Rhineland-Palatinate and Saarland, and there is also frost in sheltered valley areas. As soon as this","Tempestas: Nebula et sol in Rheno-Palatinate et Saarland. Barweiler (lrs) - In horis matutinis nebula localis in Rheno-Palatinato et Saarland est, et gelu etiam in locis vallis tuta est. Cum primum hoc",2026-03-10 13:42:19+00:00
e0b5e797642305c4dbb7f1ccb39a9179,2026-03-09T06:05:04Z,'Frost',www.stern.de,de,0.9,Wettervorhersage: Viel Sonne zum Wochenstart - Temperaturen bis 18 Grad,"Nächtlicher Frost, Regen sowie Nebel stören das überwiegend freundliche Wetter in der Hauptstadtregion kaum. Dabei klettern die Temperaturen nah an die 20-Grad-Marke heran.",https://www.stern.de/gesellschaft/regional/berlin-brandenburg/wettervorhersage--viel-sonne-zum-wochenstart---temperaturen-bis-18-grad-37203180.html,https://image.stern.de/37203182/t/BF/v1/w1440/r1.7778/-/09--u3khrbnn3ov7axs2048jpeg---b03d810833da856e.jpg,,"Kopiere den aktuellen Link
Zur Merkliste hinzufügen
Nächtlicher Frost, Regen sowie Nebel stören das überwiegend freundliche Wetter in der Hauptstadtregion kaum. Dabei klettern die Temperaturen nah … [+929 chars]",,"Wettervorhersage: Viel Sonne zum Wochenstart - Temperaturen bis 18 Grad. Nächtlicher Frost, Regen sowie Nebel stören das überwiegend freundliche Wetter in der Hauptstadtregion kaum. Dabei klettern die Temperaturen nah an die 20-Grad-Marke heran.","Weather forecast: Lots of sun at the start of the week - temperatures up to 18 degrees. Nocturnal frost, rain and fog hardly disturb the predominantly friendly weather in the capital region. The temperatures climb close to the 20 degree mark.","Tempestas praenuntientur: Sortes solis in initio hebdomadis - temperaturas usque ad 18 gradus. Nocturnae pruinae, imbres et nebulae vix amicae tempestates praevalentes turbant in regione capitali. Temperaturae proxima ad 20 gradum marcae scandunt.",2026-03-10 13:42:19+00:00
5ea462d799a37d0d762ece7c5e8f8ea6,2026-03-09T06:06:14Z,'Frost',www.tagesspiegel.de,de,0.9,Frühlingswetter in Berlin: Viel Sonne zum Wochenstart bei Temperaturen bis 18 Grad,"Nächtlicher Frost, Regen sowie Nebel stören das überwiegend freundliche Wetter in der Hauptstadtregion kaum. Dabei klettern die Temperaturen nah an die 20-Grad-Marke heran.",https://www.tagesspiegel.de/berlin/fruhlingswetter-in-berlin-viel-sonne-zum-wochenstart-bei-temperaturen-bis-18-grad-15331395.html,https://www.tagesspiegel.de/images/15331394/alternates/BASE_16_9_W1400/1773036374000/fruhling-in-berlin.jpeg,,Berlin und Brandenburg starten mit viel Sonne in die neue Woche. Dabei bleibt es laut Deutschem Wetterdienst (DWD) auch in den nächsten Tagen frühlingshaft und freundlich. Frostige Morgenstunden sowi… [+1142 chars],,"Frühlingswetter in Berlin: Viel Sonne zum Wochenstart bei Temperaturen bis 18 Grad. Nächtlicher Frost, Regen sowie Nebel stören das überwiegend freundliche Wetter in der Hauptstadtregion kaum. Dabei klettern die Temperaturen nah an die 20-Grad-Marke heran.","Spring weather in Berlin: Lots of sun at the start of the week with temperatures up to 18 degrees. Nocturnal frost, rain and fog hardly disturb the predominantly friendly weather in the capital region. The temperatures climb close to the 20 degree mark.","Tempestas vernalis in Berlin: Sortes solis ineunte septimanae cum temperaturis usque ad 18 gradus. Nocturnae pruinae, imbres et nebulae vix amicae tempestates praevalentes turbant in regione capitali. Temperaturae proxima ad 20 gradum marcae scandunt.",2026-03-10 13:42:19+00:00
2aa54e487f60c4ea8e4d6be0d532d7a3,2026-03-09T06:06:14Z,'Frost',www.tagesspiegel.de,de,0.9,Wettervorhersage: Viel Sonne zum Wochenstart - Temperaturen bis 18 Grad,"Nächtlicher Frost, Regen sowie Nebel stören das überwiegend freundliche Wetter in der Hauptstadtregion kaum. Dabei klettern die Temperaturen nah an die 20-Grad-Marke heran.",https://www.tagesspiegel.de/berlin/wettervorhersage-viel-sonne-zum-wochenstart-temperaturen-bis-18-grad-15331395.html,https://www.tagesspiegel.de/images/15331394/alternates/BASE_16_9_W1400/1773036374000/fruhling-in-berlin.jpeg,,Berlin und Brandenburg starten mit viel Sonne in die neue Woche. Dabei bleibt es laut Deutschem Wetterdienst (DWD) auch in den nächsten Tagen frühlingshaft und freundlich. Frostige Morgenstunden sowi… [+795 chars],,"Wettervorhersage: Viel Sonne zum Wochenstart - Temperaturen bis 18 Grad. Nächtlicher Frost, Regen sowie Nebel stören das überwiegend freundliche Wetter in der Hauptstadtregion kaum. Dabei klettern die Temperaturen nah an die 20-Grad-Marke heran.","Weather forecast: Lots of sun at the start of the week - temperatures up to 18 degrees. Nocturnal frost, rain and fog hardly disturb the predominantly friendly weather in the capital region. The temperatures climb close to the 20 degree mark.","Tempestas praenuntientur: Sortes solis in initio hebdomadis - temperaturas usque ad 18 gradus. Nocturnae pruinae, imbres et nebulae vix amicae tempestates praevalentes turbant in regione capitali. Temperaturae proxima ad 20 gradum marcae scandunt.",2026-03-10 13:42:19+00:00
9cf451d596bb2050f43451d741bb2b39,2026-03-03T21:44:00Z,'Wintereinbruch',www.focus.de,de,0.9,HSV empfängt Leverkusen zum Nachholspiel,"Nachdem die Partie zwischen dem HSV und Leverkusen im Januar wegen des Wintereinbruchs abgesagt werden musste, wird sie nun nachgeholt. Die Partie im Liveticker.",https://www.focus.de/sport/fussball/hsv-empfaengt-leverkusen-zum-nachholspiel_f76816fd-9e59-4361-8a62-af088b900cf2.html,https://quadro.burda-forward.de/ctf/674f806a-86c2-44ee-8c24-09aeca8a3c2e.4ab4b9ce-02cc-4b54-8d8d-1eaa7fdaefd4.jpeg?im=RegionOfInterestCrop%3D%281200%2C630%29%2CregionOfInterest%3D%281024%2C683%29&hash=d43f094a2f98b83a1ed7ead43e32fbf159718549b197d8c9e06940127c72ede1,http://web.archive.org/web/20260303235516/https://www.focus.de//sport//fussball//hsv-empfaengt-leverkusen-zum-nachholspiel_f76816fd-9e59-4361-8a62-af088b900cf2.html,Im Nachholspiel der Fußball-Bundesliga empfängt der Hamburger SV am Mittwochabend (20.30 Uhr/Sky) den Tabellensechsten Bayer Leverkusen. Während Aufsteiger Hamburg den Vorsprung auf die Abstiegsregio… [+460 chars],,"HSV empfängt Leverkusen zum Nachholspiel. Nachdem die Partie zwischen dem HSV und Leverkusen im Januar wegen des Wintereinbruchs abgesagt werden musste, wird sie nun nachgeholt. Die Partie im Liveticker.","HSV welcomes Leverkusen for a catch-up game. After the game between HSV and Leverkusen had to be canceled in January due to the onset of winter, it will now be rescheduled. The game in the live ticker.","HSV Leverkusen pro ludo excipiendo accipit. Post ludum inter HSV et Leverkusen mense Ianuario ob impetum hiemis remissum oportuit, iam reschedul erit. Lusus in ticker vivere.",2026-03-15 19:04:42+00:00
6d6e9bb01bcbba28322a7d125663983c,2026-03-11T10:20:01Z,'Frost',www.welt.de,de,0.9,Strecke Hamburg-Berlin erst ab Mitte Juni endgültig wieder frei,"Wochenlanger Frost und eine nahezu geschlossene Schneedecke im Januar hätten die Arbeiten an der Strecke Hamburg – Berlin verzögert, so die Deutsche Bahn. Nun aber steht der Zeitplan für die Wiedereröffnung, wenn auch erneut mit einer Verspätung.",https://www.welt.de/vermischtes/article69b13931234864f234f04c30/bahn-strecke-hamburg-berlin-erst-ab-mitte-juni-endgueltig-wieder-frei.html,https://images.welt.de/69b13931234864f234f04c30/4fedee8b52aafe4e0f2c4409a3f22dcd-master/ci16x9-w1200/dpa-com-20090101-260311-935-1208345-jpg,http://web.archive.org/web/20260312011959/https://www.welt.de/vermischtes/article69b13931234864f234f04c30/bahn-strecke-hamburg-berlin-erst-ab-mitte-juni-endgueltig-wieder-frei.html,Die Generalsanierung der Bahnstrecke zwischen Hamburg und Berlin verzögert sich nach Angaben der Deutschen Bahn (DB) noch einmal um mehrere Wochen: Ab 15. Mai könnten Züge zunächst wieder über den fe… [+1532 chars],,"Strecke Hamburg-Berlin erst ab Mitte Juni endgültig wieder frei. Wochenlanger Frost und eine nahezu geschlossene Schneedecke im Januar hätten die Arbeiten an der Strecke Hamburg – Berlin verzögert, so die Deutsche Bahn. Nun aber steht der Zeitplan für die Wiedereröffnung, wenn auch erneut mit einer Verspätung.","The Hamburg-Berlin route will not finally be open again until mid-June. Weeks of frost and an almost complete blanket of snow in January delayed work on the Hamburg – Berlin route, according to Deutsche Bahn. But now the schedule for reopening is in place, albeit once again delayed.","Iter Hamburg-Berlin non tandem iterum patebit usque ad medium Iunium. Hebdomadae pruinae et paene completum stragulum nivis mense Ianuario moratum opus in Hamburg – Berlin iter fecit, secundum Deutsche Bahn. Sed nunc schedula refricandi locum habet, licet iterum differatur.",2026-03-17 07:36:31+00:00
283e99e8a474b91224b70ba617d28152,2026-03-16T14:02:55Z,'Wintereinbruch',www.bild.de,de,0.9,Schnee bis zum Hals - Ferienort in den Alpen eingeschneit,Wie viel Schnee die Meteorologen eigentlich vorhergesagt hatten und welche Gefahr der massive Wintereinbruch für den kleinen Ort mit sich bringt,https://www.bild.de/news/wetter/lawinengefahr-steigt-ferienort-in-den-alpen-eingeschneit-69b7ec0c17184da7cffdb6f7,"https://images.bild.de/69b7ec0c17184da7cffdb6f7/3ecfdeffeb66986205e11c2fcbc30e99,6ed056f?w=1280",,"TTS-Player überspringenArtikel weiterlesenMacugnaga (Italien) Die Meteorologen hatten für den Norden Italiens starken Schneefall vorhergesagt. Doch was dann passierte, übertraf sogar die Erwartungen … [+1686 chars]",,Schnee bis zum Hals - Ferienort in den Alpen eingeschneit. Wie viel Schnee die Meteorologen eigentlich vorhergesagt hatten und welche Gefahr der massive Wintereinbruch für den kleinen Ort mit sich bringt,Snow up to your neck - snowbound holiday resort in the Alps. How much snow the meteorologists had actually predicted and what danger the massive onset of winter poses for the small town,"Nives usque ad collum tuum - feriae nives in Alpibus conveniunt. Quantum nivis astrologi praedixerant, et quantum periculi ingens impetus hiemis opposuit oppidulum.",2026-03-17 19:34:57+00:00
a310b692b5ffb681899eaa7486200d5c,2026-03-05T05:39:40Z,'Frost',www.zeit.de,de,0.9,"Wetter: Frostige Nächte, milde Tage in Berlin und Brandenburg","Hier finden Sie Informationen zu dem Thema „Wetter“. Lesen Sie jetzt „Frostige Nächte, milde Tage in Berlin und Brandenburg“.",https://www.zeit.de/news/2026-03/05/frostige-naechte-milde-tage-in-berlin-und-brandenburg,https://img.zeit.de/news/2026-03/05/frostige-naechte-milde-tage-in-berlin-und-brandenburg-image-group/wide__1300x731,,"Die Nächte in Berlin und Brandenburg bleiben frostig, tagsüber wird es dagegen mild. Nach Angaben des Deutschen Wetterdienstes (DWD) bestimmt eine trockene Luftmasse das Wetter in den beiden Bundeslä… [+689 chars]",,"Wetter: Frostige Nächte, milde Tage in Berlin und Brandenburg. Hier finden Sie Informationen zu dem Thema „Wetter“. Lesen Sie jetzt „Frostige Nächte, milde Tage in Berlin und Brandenburg“.","Weather: Frosty nights, mild days in Berlin and Brandenburg. Here you will find information on the topic of “weather”. Read “Frosty nights, mild days in Berlin and Brandenburg” now.","Weather: Frosty noctes, dies mites in Berlin et Brandenburg. Hic informationes invenies in argumento ""tempestatis"". Read ""Frosty noctes, dies mites in Berlin et Brandenburg"" nunc.",2026-03-18 07:35:53+00:00
9764739b55308624df12a4a1276fe1b0,2026-03-07T06:03:19Z,'Frost',www.zeit.de,de,0.9,Wetter: Sonne und Frost: So wird das Frühlingswetter am Wochenende,Hier finden Sie Informationen zu dem Thema „Wetter“. Lesen Sie jetzt „Sonne und Frost: So wird das Frühlingswetter am Wochenende“.,https://www.zeit.de/news/2026-03/07/sonne-und-frost-so-wird-das-fruehlingswetter-am-wochenende,https://img.zeit.de/news/2026-03/07/sonne-und-frost-so-wird-das-fruehlingswetter-am-wochenende-image-group/wide__1300x731,,"Hochdruckeinfluss sorgt am Wochenende für ruhiges Frühlingswetter in Berlin und Brandenburg. Viel Sonne und milde Luft prägen die nächsten Tage, wie der Deutsche Wetterdienst (DWD) mitteilte. Am Morg… [+872 chars]",,Wetter: Sonne und Frost: So wird das Frühlingswetter am Wochenende. Hier finden Sie Informationen zu dem Thema „Wetter“. Lesen Sie jetzt „Sonne und Frost: So wird das Frühlingswetter am Wochenende“.,Weather: Sun and frost: This is what the spring weather will be like this weekend. Here you will find information on the topic of “weather”. Read “Sun and Frost: This is what the spring weather will be like this weekend” now.,"Tempestas: sol et gelu: haec tempestas ver erit sicut volutpat vestibulum. Hic informationes invenies in argumento ""tempestatis"". Lege ""Sol et Frons: haec tempestas ver erit sicut volutpat vestibulum"" nunc.",2026-03-18 07:35:53+00:00
cad3e9b9e501ef08b238188e6db83691,2026-03-10T04:58:31Z,'Frost',www.zeit.de,de,0.9,"Wetter: Sonne, Frost und kurze Gewitter in Bayern möglich","Hier finden Sie Informationen zu dem Thema „Wetter“. Lesen Sie jetzt „Sonne, Frost und kurze Gewitter in Bayern möglich“.",https://www.zeit.de/news/2026-03/10/sonne-frost-und-kurze-gewitter-in-bayern-moeglich,https://img.zeit.de/news/2026-03/10/sonne-frost-und-kurze-gewitter-in-bayern-moeglich-image-group/wide__1300x731,,"In den kommenden Tagen soll es in Bayern frühlingshaft warm bleiben, vereinzelt kann es aber auch Regenphasen geben. Laut der Vorhersage des Deutschen Wetterdienstes kann es dabei besonders in Franke… [+745 chars]",,"Wetter: Sonne, Frost und kurze Gewitter in Bayern möglich. Hier finden Sie Informationen zu dem Thema „Wetter“. Lesen Sie jetzt „Sonne, Frost und kurze Gewitter in Bayern möglich“.","Weather: Sun, frost and short thunderstorms possible in Bavaria. Here you will find information on the topic of “weather”. Read now “Sun, frost and short thunderstorms possible in Bavaria”.","Tempestas: sol, pruina et brevia tonitribus possibilia sunt in Bavaria. Hic informationes invenies in argumento ""tempestatis"". Lege nunc ""sol, pruina et brevia tonitribus possibilibus in Bavaria"".",2026-03-18 07:35:53+00:00
7f3b6848c7ac949d3925a9d8280d13e0,2026-03-17T05:37:40Z,'Frost',www.zeit.de,de,0.9,"Wetter: Sonne am Tag, Frost in der Nacht in Berlin und Brandenburg","Hier finden Sie Informationen zu dem Thema „Wetter“. Lesen Sie jetzt „Sonne am Tag, Frost in der Nacht in Berlin und Brandenburg“.",https://www.zeit.de/news/2026-03/17/sonne-am-tag-frost-in-der-nacht-in-berlin-und-brandenburg,https://img.zeit.de/news/2026-03/17/sonne-am-tag-frost-in-der-nacht-in-berlin-und-brandenburg-image-group/wide__1300x731,,In Berlin und Brandenburg bleibt das Wetter wechselhaft. Nach Angaben des Deutschen Wetterdienstes (DWD) ist in der Nacht und am Morgen noch mit Frost und mit Temperaturen bis zu minus drei Grad zu r… [+409 chars],,"Wetter: Sonne am Tag, Frost in der Nacht in Berlin und Brandenburg. Hier finden Sie Informationen zu dem Thema „Wetter“. Lesen Sie jetzt „Sonne am Tag, Frost in der Nacht in Berlin und Brandenburg“.","Weather: Sun during the day, frost at night in Berlin and Brandenburg. Here you will find information on the topic of “weather”. Now read “Sun during the day, frost at night in Berlin and Brandenburg”.","Tempestas: sol interdiu, noctu gelu in Berlin et Brandenburg. Hic informationes invenies in argumento ""tempestatis"". Nunc legitur ""Sol interdiu, noctu gelu in Berlin et Brandenburg.""",2026-03-18 07:35:53+00:00
980408dc91fbe37d1091e122cf42b182,2026-03-17T05:42:30Z,'Frost',www.zeit.de,de,0.9,"Wetter: Wetter in Norddeutschland: Sonne, Frost und später Regen","Hier finden Sie Informationen zu dem Thema „Wetter“. Lesen Sie jetzt „Wetter in Norddeutschland: Sonne, Frost und später Regen“.",https://www.zeit.de/news/2026-03/17/wetter-in-norddeutschland-sonne-frost-und-spaeter-regen,https://img.zeit.de/news/2026-03/17/wetter-in-norddeutschland-sonne-frost-und-spaeter-regen-image-group/wide__1300x731,,Am Dienstag bleibt es in Hamburg und Schleswig-Holstein bewölkt mit gebietsweisem Regen. Die Höchstwerte liegen laut dem Deutschen Wetterdienst (DWD) zwischen neun Grad auf den Inseln und zwölf Grad … [+1427 chars],,"Wetter: Wetter in Norddeutschland: Sonne, Frost und später Regen. Hier finden Sie Informationen zu dem Thema „Wetter“. Lesen Sie jetzt „Wetter in Norddeutschland: Sonne, Frost und später Regen“.","Weather: Weather in northern Germany: sun, frost and later rain. Here you will find information on the topic of “weather”. Read “Weather in Northern Germany: sun, frost and later rain” now.","Tempestas: Tempestas in Germania septentrionali: sol, gelu et serotinus. Hic informationes invenies in argumento ""tempestatis"". Legere ""Tempestas in Germania septentrionali: sol, gelu et post pluviam"" nunc.",2026-03-18 07:35:53+00:00
a41e640a8b77e57a8316cd40b38a1057,2026-03-17T05:49:40Z,'Frost',www.zeit.de,de,0.9,Wetter: DWD warnt vor Frost und Glätte im Osten,Hier finden Sie Informationen zu dem Thema „Wetter“. Lesen Sie jetzt „DWD warnt vor Frost und Glätte im Osten“.,https://www.zeit.de/news/2026-03/17/dwd-warnt-vor-frost-und-glaette-im-osten,https://img.zeit.de/news/2026-03/17/dwd-warnt-vor-frost-und-glaette-im-osten-image-group/wide__1300x731,,"Frost und überfrierende Nässe können am Dienstagmorgen für Glätte und gefährliche Straßenbedingungen sorgen. Der Deutsche Wetterdienst (DWD) warnt in den Frühstunden lokal vor Glätte in Sachsen, Sach… [+518 chars]",,Wetter: DWD warnt vor Frost und Glätte im Osten. Hier finden Sie Informationen zu dem Thema „Wetter“. Lesen Sie jetzt „DWD warnt vor Frost und Glätte im Osten“.,Weather: DWD warns of frost and slippery conditions in the east. Here you will find information on the topic of “weather”. Now read “DWD warns of frost and slippery conditions in the east”.,"Tempestas: DWD monet gelu et lubricum in oriente. Hic informationes invenies in argumento ""tempestatis"". Nunc legere ""DWD monet frigoris et lubricae condicionis in oriente"".",2026-03-18 07:35:53+00:00
2b41719804d665ec53464a1e2a994489,2026-03-17T07:02:50Z,'Frost',www.zeit.de,de,0.9,"Wetter: Frost, aber auch sonnig warm in Rheinland-Pfalz und Saarland","Hier finden Sie Informationen zu dem Thema „Wetter“. Lesen Sie jetzt „Frost, aber auch sonnig warm in Rheinland-Pfalz und Saarland“.",https://www.zeit.de/news/2026-03/17/frost-aber-auch-sonnig-warm-in-rheinland-pfalz-und-saarland,https://img.zeit.de/news/2026-03/17/frost-aber-auch-sonnig-warm-in-rheinland-pfalz-und-saarland-image-group/wide__1300x731,,"Rheinland-Pfalz und Saarland erwarten in den kommenden Tagen Sonne und frühlingshafte Temperaturen, nachts ist es frostig. Stark bewölkt bis bedeckt lautet die Prognose des Deutschen Wetterdienstes (… [+765 chars]",,"Wetter: Frost, aber auch sonnig warm in Rheinland-Pfalz und Saarland. Hier finden Sie Informationen zu dem Thema „Wetter“. Lesen Sie jetzt „Frost, aber auch sonnig warm in Rheinland-Pfalz und Saarland“.","Weather: Frost, but also sunny and warm in Rhineland-Palatinate and Saarland. Here you will find information on the topic of “weather”. Now read “Frost, but also sunny and warm in Rhineland-Palatinate and Saarland”.","Tempestas: Frost, sed etiam aprica et calida in Rheno-Palatinate et Saarland. Hic informationes invenies in argumento ""tempestatis"". Nunc legitur ""Frost, sed etiam serenum et calidum in Rheno-Palatinate et Saarland"".",2026-03-18 07:35:53+00:00
565c4ed264985fd900c55e66f85b12ab,2026-03-13T23:25:04Z,'Kaltfront Winter',www.stern.de,de,0.8,Wettervorhersage: Von wegen Frühling: Kaltfront überquert Deutschland,"Offenbach - Comeback für dicke Jacken, Handschuhe und Mützen: Der Winter gibt sich nicht geschlagen. Von Ost nach West zieht eine Kaltfront über",https://www.stern.de/panorama/wettervorhersage--von-wegen-fruehling--kaltfront-ueberquert-deutschland-37220436.html,https://image.stern.de/37220438/t/5t/v1/w1440/r1.7778/-/14--dr7ysvkroxv6axs2048jpeg---030b345765ee3d60.jpg,http://web.archive.org/web/20260313235220/https://www.stern.de/panorama/wettervorhersage--von-wegen-fruehling--kaltfront-ueberquert-deutschland-37220436.html,"Kopiere den aktuellen Link
Zur Merkliste hinzufügen
Wer gehofft hat, dass der Winter vorbei ist, der hat sich zu früh gefreut. Der Wetterausblick.
Comeback für dicke Jacken, Handschuhe und Mützen:… [+1321 chars]",,"Wettervorhersage: Von wegen Frühling: Kaltfront überquert Deutschland. Offenbach - Comeback für dicke Jacken, Handschuhe und Mützen: Der Winter gibt sich nicht geschlagen. Von Ost nach West zieht eine Kaltfront über","Weather forecast: Not spring: cold front crosses Germany. Offenbach - Comeback for thick jackets, gloves and hats: Winter is not giving up. A cold front is moving from east to west","Weather forecast: Not spring: frigus frontem transit Germaniam. Offenbach - Comeback crassas tunicas, chirothecas et hats: Hiems non dat. A fronte frigida est movere ab oriente in occidentem",2026-03-20 03:44:42+00:00
d0b5f3f3dd81d48fe4ee849eac7104de,2026-03-13T23:26:16Z,'Kaltfront Winter',www.tagesspiegel.de,de,0.8,Wettervorhersage: Von wegen Frühling: Kaltfront überquert Deutschland,"Wer gehofft hat, dass der Winter vorbei ist, der hat sich zu früh gefreut. Der Wetterausblick.",https://www.tagesspiegel.de/gesellschaft/panorama/wettervorhersage-von-wegen-fruhling-kaltfront-uberquert-deutschland-15355971.html,https://www.tagesspiegel.de/images/15355970/alternates/BASE_16_9_W1400/1773444376000/wetter-in-deutschland.jpeg,http://web.archive.org/web/20260315163250/https://www.tagesspiegel.de/gesellschaft/panorama/wettervorhersage-von-wegen-fruhling-kaltfront-uberquert-deutschland-15355971.html,"Comeback für dicke Jacken, Handschuhe und Mützen: Der Winter gibt sich nicht geschlagen. Von Ost nach West zieht eine Kaltfront über Deutschland. Es ist deshalb deutlich kühler als zuletzt. In Teilen… [+1267 chars]",,"Wettervorhersage: Von wegen Frühling: Kaltfront überquert Deutschland. Wer gehofft hat, dass der Winter vorbei ist, der hat sich zu früh gefreut. Der Wetterausblick.",Weather forecast: Not spring: cold front crosses Germany. Anyone who hoped that winter would be over was rejoicing too soon. The weather outlook.,"Weather forecast: Not spring: frigus frontem transit Germaniam. Omnis qui sperabat hiemem fore, maturius gaudebat. Tempestas prospectans.",2026-03-20 03:44:42+00:00
d6fc65f999eacec166b39c8cec631688,2026-03-19T04:52:13Z,'Frost',www.stern.de,de,0.9,Wettervorhersage: Bayern erwartet sonnigen Donnerstag,München (lby) - Die Menschen in Bayern können sich auf einen sonnigen Donnerstag freuen. Nach einer weitgehend klaren Nacht und teilweise leichtem Frost –,https://www.stern.de/gesellschaft/regional/bayern/wettervorhersage--bayern-erwartet-sonnigen-donnerstag-37235282.html,https://image.stern.de/37235284/t/qY/v1/w1440/r1.7778/-/19--qxb5o4q3s4v3axs2048jpeg---48d8a838186da832.jpg,,"Kopiere den aktuellen Link
Zur Merkliste hinzufügen
Nach Regen und kühlen Temperaturen erwartet die Menschen in Bayern ein sonniger Donnerstag.
Die Menschen in Bayern können sich auf einen sonnige… [+562 chars]",,Wettervorhersage: Bayern erwartet sonnigen Donnerstag. München (lby) - Die Menschen in Bayern können sich auf einen sonnigen Donnerstag freuen. Nach einer weitgehend klaren Nacht und teilweise leichtem Frost –,Weather forecast: Bavaria expects a sunny Thursday. Munich (lby) - People in Bavaria can look forward to a sunny Thursday. After a largely clear night and partly light frost –,"Tempestas praenuntietur: Bavaria exspectat Iovis aprici. Munich (lby) - Homines in Bavaria spectare possunt ad Iovis apricum. Post multam noctem claram, partim levis pruina;",2026-03-22 03:59:49+00:00
