index,published,keyword,domain,language,valid,title,description,url,image,archive,content,quote,de,en,la,added
7013df02ba83ad1d274924de359e715a,2026-03-19T05:41:37Z,'Frost',www.zeit.de,de,0.9,"Wetter: Leichter Frost, Nebel und Sonne am Wochenende im Norden","Hier finden Sie Informationen zu dem Thema „Wetter“. Lesen Sie jetzt „Leichter Frost, Nebel und Sonne am Wochenende im Norden“.",https://www.zeit.de/news/2026-03/19/leichter-frost-nebel-und-sonne-am-wochenende-im-norden,https://img.zeit.de/news/2026-03/19/leichter-frost-nebel-und-sonne-am-wochenende-im-norden-image-group/wide__1300x731,http://web.archive.org/web/20260320055042/https://www.zeit.de/news/2026-03/19/leichter-frost-nebel-und-sonne-am-wochenende-im-norden,"Zum Wochenende hin wird es im Norden freundlich mit leichtem Frost und teilweise Nebel in den Nachtstunden.
Am Donnerstag scheint in allen Regionen die Sonne und es bleibt trocken. Im Tagesverlauf k… [+940 chars]",,"Wetter: Leichter Frost, Nebel und Sonne am Wochenende im Norden. Hier finden Sie Informationen zu dem Thema „Wetter“. Lesen Sie jetzt „Leichter Frost, Nebel und Sonne am Wochenende im Norden“.","Weather: Light frost, fog and sun at the weekend in the north. Here you will find information on the topic of “weather”. Now read “Light frost, fog and sun this weekend in the north”.","Tempestas: lux gelu, nebula et sol volutpat in septentrione. Hic informationes invenies in argumento ""tempestatis"". Nunc legitur ""Lumen gelu, nebula et sol volutpat vestibulum hoc in septentrione"".",2026-03-22 03:59:49+00:00
030aec9194360c4b1ae30a5840beebb2,2026-03-19T05:41:37Z,'Frost',www.stern.de,de,0.9,"Wetter: Leichter Frost, Nebel und Sonne am Wochenende im Norden","Nachts Nebel und leichter Frost, tagsüber Sonne: Im Norden erwartet der DWD meist freundliches Wetter mit Temperaturen von minus drei bis 17 Grad.",https://www.stern.de/gesellschaft/regional/hamburg-schleswig-holstein/wetter--leichter-frost--nebel-und-sonne-am-wochenende-im-norden-37235384.html,https://image.stern.de/37235386/t/ID/v1/w1440/r1.7778/-/19--ax2i5yuchhv14axs2048jpeg---9ea42f5240c85a79.jpg,,"Kopiere den aktuellen Link
Zur Merkliste hinzufügen
Nachts Nebel und leichter Frost, tagsüber Sonne: Im Norden erwartet der DWD meist freundliches Wetter mit Temperaturen von minus drei bis 17 Grad… [+1102 chars]",,"Wetter: Leichter Frost, Nebel und Sonne am Wochenende im Norden. Nachts Nebel und leichter Frost, tagsüber Sonne: Im Norden erwartet der DWD meist freundliches Wetter mit Temperaturen von minus drei bis 17 Grad.","Weather: Light frost, fog and sun at the weekend in the north. Fog and light frost at night, sun during the day: In the north, the DWD expects mostly friendly weather with temperatures of minus three to 17 degrees.","Tempestas: lux gelu, nebula et sol volutpat in septentrione. Nebula et gelu lucis sub nocte, sol interdiu: In septentrione, DWD exspectat maxime amicas tempestates cum temperaturis minus trium ad 17 gradus.",2026-03-22 03:59:49+00:00
5f335ef696d1e42608c9dac5611aa1e7,2026-03-20T05:21:48Z,'Frost',www.zeit.de,de,0.9,Vorhersage: Wetter dreht am Wochenende – Sonne nach Regen und Frost,Hier finden Sie Informationen zu dem Thema „Vorhersage“. Lesen Sie jetzt „Wetter dreht am Wochenende – Sonne nach Regen und Frost“.,https://www.zeit.de/news/2026-03/20/wetter-dreht-am-wochenende-sonne-nach-regen-und-frost,https://img.zeit.de/news/2026-03/20/wetter-dreht-am-wochenende-sonne-nach-regen-und-frost-image-group/wide__1300x731,,"Heute zeigt sich das Wetter in Berlin und Brandenburg zunächst von seiner grauen Seite. Wie der Deutsche Wetterdienst (DWD) mitteilte, fällt vor allem in der Südhälfte Brandenburgs zeitweise etwas Re… [+798 chars]",,Vorhersage: Wetter dreht am Wochenende – Sonne nach Regen und Frost. Hier finden Sie Informationen zu dem Thema „Vorhersage“. Lesen Sie jetzt „Wetter dreht am Wochenende – Sonne nach Regen und Frost“.,Forecast: Weather turns over the weekend - sunshine after rain and frost. Here you will find information on the topic of “prediction”. Now read “The weather turns at the weekend – sunshine after rain and frost”.,"Praedictio: Tempestas volvitur super weekend - soles post pluviam et pruinam. Hic informationes invenies in argumento ""praedictionis"". Nunc legitur ""Tempestas volutpat volvitur - sole post pluviam et pruinam"".",2026-03-22 03:59:49+00:00
561b95a1a36acbbfe92908aa46e0be0b,2026-03-20T05:21:48Z,'Frost',www.stern.de,de,0.9,Vorhersage: Wetter dreht am Wochenende – Sonne nach Regen und Frost,"Erst Regen und graue Wolken, dann Sonne satt: Wie sich das Wetter am Wochenende in Berlin und Brandenburg wandelt und wo Frost und Nebel erwartet werden.",https://www.stern.de/gesellschaft/regional/berlin-brandenburg/vorhersage--wetter-dreht-am-wochenende---sonne-nach-regen-und-frost-37238918.html,https://image.stern.de/37238920/t/OW/v1/w1440/r1.7778/-/20--h634rcllw2v5axs2048jpeg---603f52844b4432f2.jpg,,"Kopiere den aktuellen Link
Zur Merkliste hinzufügen
Erst Regen und graue Wolken, dann Sonne satt: Wie sich das Wetter am Wochenende in Berlin und Brandenburg wandelt und wo Frost und Nebel erwartet… [+967 chars]",,"Vorhersage: Wetter dreht am Wochenende – Sonne nach Regen und Frost. Erst Regen und graue Wolken, dann Sonne satt: Wie sich das Wetter am Wochenende in Berlin und Brandenburg wandelt und wo Frost und Nebel erwartet werden.","Forecast: Weather turns over the weekend - sunshine after rain and frost. First rain and gray clouds, then plenty of sun: How the weather is changing over the weekend in Berlin and Brandenburg and where frost and fog are expected.","Praedictio: Tempestas volvitur super weekend - soles post pluviam et pruinam. Primo imbres et nubes grisea, deinde solis copia: quomodo tempestas in Berolinensi et Brandenburgico volutpat mutatur et ubi gelu et nebula expectantur.",2026-03-22 03:59:49+00:00
6044582a41b036e633349783e0258835,2026-03-20T05:22:59Z,'Frost',www.tagesspiegel.de,de,0.9,Wochenendwetter für Berlin und Brandenburg: Nach Regen und Frost kommt die Sonne zurück,"Erst Regen und graue Wolken, dann Sonne satt: Wie sich das Wetter am Wochenende in Berlin und Brandenburg wandelt und wo Frost und Nebel erwartet werden.",https://www.tagesspiegel.de/berlin/wochenendwetter-fur-berlin-und-brandenburg-nach-regen-und-frost-kommt-die-sonne-zuruck-15381145.html,https://www.tagesspiegel.de/images/15381144/alternates/BASE_16_9_W1400/1773988682000/morgenstimmung-in-brandenburg.jpeg,,"Am Freitag zeigt sich das Wetter in Berlin und Brandenburg zunächst von seiner grauen Seite. Wie der Deutsche Wetterdienst (DWD) mitteilte, fällt vor allem in der Südhälfte Brandenburgs zeitweise etw… [+1257 chars]",,"Wochenendwetter für Berlin und Brandenburg: Nach Regen und Frost kommt die Sonne zurück. Erst Regen und graue Wolken, dann Sonne satt: Wie sich das Wetter am Wochenende in Berlin und Brandenburg wandelt und wo Frost und Nebel erwartet werden.","Weekend weather for Berlin and Brandenburg: After rain and frost, the sun is coming back. First rain and gray clouds, then plenty of sun: How the weather is changing over the weekend in Berlin and Brandenburg and where frost and fog are expected.","Volutpat tempestatum Berolini et Brandenburgici: Post imbrem et pruinam sol revertitur. Primo imbres et nubes grisea, deinde solis copia: quomodo tempestas in Berolinensi et Brandenburgico volutpat mutatur et ubi gelu et nebula expectantur.",2026-03-22 03:59:49+00:00
59e0dde98b51ad86b87645773fb8df76,2026-03-20T05:22:59Z,'Frost',www.tagesspiegel.de,de,0.9,Vorhersage: Wetter dreht am Wochenende – Sonne nach Regen und Frost,"Erst Regen und graue Wolken, dann Sonne satt: Wie sich das Wetter am Wochenende in Berlin und Brandenburg wandelt und wo Frost und Nebel erwartet werden.",https://www.tagesspiegel.de/berlin/vorhersage-wetter-dreht-am-wochenende--sonne-nach-regen-und-frost-15381145.html,https://www.tagesspiegel.de/images/15381144/alternates/BASE_16_9_W1400/1773984179000/morgenstimmung-in-brandenburg.jpeg,,"Heute zeigt sich das Wetter in Berlin und Brandenburg zunächst von seiner grauen Seite. Wie der Deutsche Wetterdienst (DWD) mitteilte, fällt vor allem in der Südhälfte Brandenburgs zeitweise etwas Re… [+854 chars]",,"Vorhersage: Wetter dreht am Wochenende – Sonne nach Regen und Frost. Erst Regen und graue Wolken, dann Sonne satt: Wie sich das Wetter am Wochenende in Berlin und Brandenburg wandelt und wo Frost und Nebel erwartet werden.","Forecast: Weather turns over the weekend - sunshine after rain and frost. First rain and gray clouds, then plenty of sun: How the weather is changing over the weekend in Berlin and Brandenburg and where frost and fog are expected.","Praedictio: Tempestas volvitur super weekend - soles post pluviam et pruinam. Primo imbres et nubes grisea, deinde solis copia: quomodo tempestas in Berolinensi et Brandenburgico volutpat mutatur et ubi gelu et nebula expectantur.",2026-03-22 03:59:49+00:00
ddbc9e3a3f04bf5f15273f0e479f3a47,2026-03-20T07:28:58Z,'Frost',www.stern.de,de,0.9,"Wetter: Wechselhaftes Wochenende, danach wieder freundlicher","Kalte Nächte, Nebel und sogar Frost – das Wochenende bringt in einige Wetter-Überraschungen nach Sachsen, Sachsen-Anhalt und Thüringen. Wie geht es zum Wochenstart weiter?",https://www.stern.de/gesellschaft/regional/sachsen/wetter--wechselhaftes-wochenende--danach-wieder-freundlicher-37239124.html,https://image.stern.de/37239126/t/pF/v1/w1440/r1.7778/-/20--b3kjyclhnnv5axs2048jpeg---a7bb01fa915888cd.jpg,,"Kopiere den aktuellen Link
Zur Merkliste hinzufügen
Kalte Nächte, Nebel und sogar Frost das Wochenende bringt in einige Wetter-Überraschungen nach Sachsen, Sachsen-Anhalt und Thüringen. Wie geht es… [+1107 chars]",,"Wetter: Wechselhaftes Wochenende, danach wieder freundlicher. Kalte Nächte, Nebel und sogar Frost – das Wochenende bringt in einige Wetter-Überraschungen nach Sachsen, Sachsen-Anhalt und Thüringen. Wie geht es zum Wochenstart weiter?","Weather: Changeable weekend, then friendlier again. Cold nights, fog and even frost – the weekend brings some weather surprises to Saxony, Saxony-Anhalt and Thuringia. What's next for the start of the week?","Tempestas: Mutabilis volutpat, tunc amicior iterum. Noctes frigidas, nebulas et etiam pruinas – auctor tempestatis nonnullas admirationes affert in Saxoniam, Saxoniam, Anhaltensem et Thuringiam. Quid deinde ad initium septimanae?",2026-03-22 03:59:49+00:00
e2d59297cedfb9fe8360e778f807c48a,2026-03-13T03:58:26Z,'Glatteis',www.bild.de,de,0.9,Wetter fährt Achterbahn - Das Wochenende bringt Sturm und Schnee,"Sturm, Schnee und Glatteis erwarten Deutschland am Wochenende. Wie welcher Tag wird und wie die regionalen Unterschiede sind.",https://www.bild.de/news/wetter/wetter-faehrt-achterbahn-das-wochenende-bringt-sturm-und-schnee-69b2a3c7edb67419c43bd6fb,"https://images.bild.de/69b2a3c7edb67419c43bd6fb/f25c3c7cb054e056f0394971f1da405e,be7f377d?w=1280",,"TTS-Player überspringenArtikel weiterlesenApril, April, der macht, was er will. Dabei haben wir erst März. Trotzdem erwartet uns am Wochenende ein wilder Wetter-Mix, wie er eigentlich dem kommenden M… [+3238 chars]",,"Wetter fährt Achterbahn - Das Wochenende bringt Sturm und Schnee. Sturm, Schnee und Glatteis erwarten Deutschland am Wochenende. Wie welcher Tag wird und wie die regionalen Unterschiede sind.","The weather is a rollercoaster - the weekend brings storms and snow. Storms, snow and black ice await Germany this weekend. What day will be and what the regional differences are.","Tempestas rollercoaster est - volutpat procellas et nives affert. Tempestates, nix et gelu nigrum expectant Germaniam volutpat id. Qui dies, et quae sint discrimina regionum.",2026-03-24 13:55:26+00:00
969f6719d448a9fbc0929b8e48da8dae,2026-03-17T06:41:00Z,'Kältewelle',www.discountfan.de,de,0.9,"Outlet46: Doppelpack Kuscheldecken für 9,99 Euro","Anzeige*Der Winter geht in die Verlängerung. Passend zur aktuellen Kältewelle ist jetzt bei Outlet46 ein Doppelpack Kuscheldecken für 9,99 Euro zu haben – zur Auswahl stehen vier verschiedene Farben. Das Doppelpack Kuscheldecken für 9,99 Euro ist nur für kurz…",https://www.discountfan.de/artikel/news/outlet46-doppelpack-kuscheldecken-fuer-999-euro,,http://web.archive.org/web/20260318162721/https://www.discountfan.de/artikel/news/outlet46-doppelpack-kuscheldecken-fuer-999-euro,"Outlet46: Doppelpack Kuscheldecken für 9,99 Euro (Bild: Outlet46) 
Das Doppelpack Kuscheldecken für 9,99 Euro ist nur für kurze Zeit im Angebot, solange Vorrat reicht. Die Decken sind 127 auf 165 Ze… [+559 chars]",,"Outlet46: Doppelpack Kuscheldecken für 9,99 Euro. Anzeige*Der Winter geht in die Verlängerung. Passend zur aktuellen Kältewelle ist jetzt bei Outlet46 ein Doppelpack Kuscheldecken für 9,99 Euro zu haben – zur Auswahl stehen vier verschiedene Farben. Das Doppelpack Kuscheldecken für 9,99 Euro ist nur für kurz…","Outlet46: Double pack of cuddly blankets for 9.99 euros. Advertisement*Winter is extending. In keeping with the current cold spell, a double pack of cuddly blankets is now available at Outlet46 for 9.99 euros - there are four different colors to choose from. The double pack of cuddly blankets for 9.99 euros is only available for a short time...","Outlet46: Double pack of GRATUS stragulis 9.99 nummis. Advertisement*Hiems extendit. Secundum hodiernam frigus incantatores, duplex fasciculus GRATUS stragulorum nunc in Outlet46 praesto est pro 9.99 nummis - quattuor colores e eligendo sunt. Duplex fasciculus GRATUS stragulis 9.99 nummis in promptu est ad breve tempus...",2026-03-24 13:55:26+00:00
7e0a9263c47301cdbe173d681721d11f,2026-03-23T04:58:07Z,'Wintereinbruch',www.bild.de,de,0.9,"Kaltfront bremst den Frühling aus - Erst Sonne pur, dann Wintereinbruch","Zum Wochenstart ist das Wetter noch schön. Dann bringt die Kaltfront Schnee, Frost und Glatteis. Alle Details zum Wetter in dieser Woche.",https://www.bild.de/news/wetter/erst-sonne-pur-dann-wintereinbruch-kaltfront-bremst-diese-woche-den-fruehling-aus-69bfd9b98f5761671715b569,"https://images.bild.de/69bfd9b98f5761671715b569/db45bb3d89da0f0cabe1d90140a1d1a8,b0c9f094?w=1280",,"TTS-Player überspringenArtikel weiterlesenZum Start der neuen Woche gibt es noch Sonnenschein. Doch dann kommt die Wetter-Wende. Ab Mittwoch kommt eine Kaltfront, sie bringt sogar Schnee bis in tiefe… [+3279 chars]",,"Kaltfront bremst den Frühling aus - Erst Sonne pur, dann Wintereinbruch. Zum Wochenstart ist das Wetter noch schön. Dann bringt die Kaltfront Schnee, Frost und Glatteis. Alle Details zum Wetter in dieser Woche.","Cold front slows down spring - first pure sunshine, then the onset of winter. The weather is still nice at the start of the week. Then the cold front brings snow, frost and black ice. All the details about the weather this week.","Cold front slows down spring - first pure sunshine, then the onset of winter. Tempestas adhuc delicatus in initio sabbati. Tum frons frigida nix, pruinas et atra glaciem. Singula de tempestate hac septimana.",2026-03-24 13:55:26+00:00
6ec4c8657ed8cb0c3a556a294cee7327,2026-03-25T04:58:28Z,'Glatteis',www.bild.de,de,0.9,Wo es jetzt Schnee gibt - Kälteeinbruch! Polarfront erreicht Deutschland,Viele Wolken und Regen bestimmen das Wetter. Und es ist wieder Schnee im Anflug.,https://www.bild.de/news/wetter/kaelteeinbruch-polarfront-mit-schnee-erreicht-deutschland-69c263208f5761671715d8e9,"https://images.bild.de/69c263208f5761671715d8e9/2c728b2f23832e0a833e596716d704ae,49eda67?w=1280",http://web.archive.org/web/20260325225004/https://www.bild.de/news/wetter/kaelteeinbruch-polarfront-mit-schnee-erreicht-deutschland-69c263208f5761671715d8e9,"TTS-Player überspringenArtikel weiterlesenJetzt ist Schluss mit Sonnenschein. Der Mittwoch stimmt eiskalt auf die nächsten Tage ein. Nicht nur viele Wolken, sondern auch Regen- und Graupelschauer sin… [+3475 chars]",,Wo es jetzt Schnee gibt - Kälteeinbruch! Polarfront erreicht Deutschland. Viele Wolken und Regen bestimmen das Wetter. Und es ist wieder Schnee im Anflug.,Where there is snow now - cold snap! Polar front reaches Germany. Lots of clouds and rain determine the weather. And there is snow coming again.,Ubi nunc nix est - franguntur frigus! Ante Polarem Germaniam attingit. Sortes nubium et pluviarum tempestatum determinant. Et iterum venit nix.,2026-04-14 19:48:33+00:00
3f253ad47015ac78ad23c0b7898bce17,2026-03-31T05:08:45Z,'Glatteis',www.stern.de,de,0.9,Verkehr: Eisregen sorgt für Unfälle mit sechs Fahrzeugen auf der A7,Homberg/Efze (lhe) - Auf der Autobahn 7 zwischen Homberg (Efze) und Bad Hersfeld West im Schwalm-Eder-Kreis sind mehrere Fahrzeuge infolge von Glatteis,https://www.stern.de/gesellschaft/regional/hessen/verkehr--eisregen-sorgt-fuer-unfaelle-mit-sechs-fahrzeugen-auf-der-a7-37269932.html,https://image.stern.de/37269934/t/dQ/v1/w1440/r1.7778/-/31--x4wf427tqvv1axs2048jpeg---834f9f6755c0a341.jpg,,"Kopiere den aktuellen Link
Zur Merkliste hinzufügen
Glatteis überrascht Autofahrer auf der A7: Sechs Fahrzeuge verunfallen, Abschleppwagen rücken an. Verletzt wird glücklicherweise niemand.
Auf de… [+730 chars]",,Verkehr: Eisregen sorgt für Unfälle mit sechs Fahrzeugen auf der A7. Homberg/Efze (lhe) - Auf der Autobahn 7 zwischen Homberg (Efze) und Bad Hersfeld West im Schwalm-Eder-Kreis sind mehrere Fahrzeuge infolge von Glatteis,Traffic: Freezing rain causes accidents involving six vehicles on the A7. Homberg/Efze (lhe) - Several vehicles are on the Autobahn 7 between Homberg (Efze) and Bad Hersfeld West in the Schwalm-Eder district due to black ice,Negotiatio: glacians pluviae causat accidentia sex vehicula in A7. Homberg/Efze (lhe) - Plures vehicula in Autobahn 7 inter Hombergum (Efze) et Malum Hersfeldium occidentale in regione Schwalm-Eder ob glaciem nigram.,2026-04-14 19:48:33+00:00
